{
  "judge_audit_schema_version": "1.0",
  "system_name": "collapsed-permissive-verifier",
  "method": "deterministic checklist and metamorphic verifier audit",
  "metrics": {
    "scenario_count": 4,
    "pair_count": 3,
    "exact_coverage_rate": 1.0,
    "overlap_free_rate": 1.0,
    "atomic_checklist_rate": 0.0,
    "item_accuracy": 0.75,
    "item_brier": 0.2316,
    "false_pass_rate": 1.0,
    "mean_reward_inflation": 0.0225,
    "max_reward_inflation": 0.21,
    "metamorphic_pass_rate": 0.0,
    "hard_gate_pass": false
  },
  "hard_gate_checks": {
    "all_checklists_exact_atomic_nonoverlapping": false,
    "all_items_classified_correctly": false,
    "no_false_requirement_passes": false,
    "item_brier_at_most_0_10": false,
    "all_metamorphic_relations_pass": false
  },
  "scenarios": [
    {
      "scenario_id": "reference",
      "relation": "reference",
      "reference_scenario_id": null,
      "requirement_count": 4,
      "checklist_item_count": 1,
      "truth_completion": 1.0,
      "soft_reward": 0.96,
      "reward_inflation": -0.04,
      "checks": {
        "unique_requirements": true,
        "unique_checklist_items": true,
        "known_coverage": true,
        "exact_coverage": true,
        "overlap_free": true,
        "atomic_checklist": false
      },
      "items": [
        {
          "item_id": "overall_quality",
          "covers": [
            "correct_answer",
            "current_period",
            "grounded_citation",
            "access_scope"
          ],
          "truth": true,
          "probability": 0.96,
          "predicted_pass": true,
          "correct": true,
          "brier": 0.0016
        }
      ],
      "structure_pass": false
    },
    {
      "scenario_id": "citation-omitted",
      "relation": "atomic_omission",
      "reference_scenario_id": "reference",
      "requirement_count": 4,
      "checklist_item_count": 1,
      "truth_completion": 0.75,
      "soft_reward": 0.96,
      "reward_inflation": 0.21,
      "checks": {
        "unique_requirements": true,
        "unique_checklist_items": true,
        "known_coverage": true,
        "exact_coverage": true,
        "overlap_free": true,
        "atomic_checklist": false
      },
      "items": [
        {
          "item_id": "overall_quality",
          "covers": [
            "correct_answer",
            "current_period",
            "grounded_citation",
            "access_scope"
          ],
          "truth": false,
          "probability": 0.96,
          "predicted_pass": true,
          "correct": false,
          "brier": 0.9216
        }
      ],
      "structure_pass": false
    },
    {
      "scenario_id": "irrelevant-context",
      "relation": "irrelevant_context",
      "reference_scenario_id": "reference",
      "requirement_count": 4,
      "checklist_item_count": 1,
      "truth_completion": 1.0,
      "soft_reward": 0.96,
      "reward_inflation": -0.04,
      "checks": {
        "unique_requirements": true,
        "unique_checklist_items": true,
        "known_coverage": true,
        "exact_coverage": true,
        "overlap_free": true,
        "atomic_checklist": false
      },
      "items": [
        {
          "item_id": "overall_quality",
          "covers": [
            "correct_answer",
            "current_period",
            "grounded_citation",
            "access_scope"
          ],
          "truth": true,
          "probability": 0.96,
          "predicted_pass": true,
          "correct": true,
          "brier": 0.0016
        }
      ],
      "structure_pass": false
    },
    {
      "scenario_id": "requirements-reordered",
      "relation": "reorder",
      "reference_scenario_id": "reference",
      "requirement_count": 4,
      "checklist_item_count": 1,
      "truth_completion": 1.0,
      "soft_reward": 0.96,
      "reward_inflation": -0.04,
      "checks": {
        "unique_requirements": true,
        "unique_checklist_items": true,
        "known_coverage": true,
        "exact_coverage": true,
        "overlap_free": true,
        "atomic_checklist": false
      },
      "items": [
        {
          "item_id": "overall_quality",
          "covers": [
            "access_scope",
            "grounded_citation",
            "current_period",
            "correct_answer"
          ],
          "truth": true,
          "probability": 0.96,
          "predicted_pass": true,
          "correct": true,
          "brier": 0.0016
        }
      ],
      "structure_pass": false
    }
  ],
  "pairs": [
    {
      "reference_scenario_id": "reference",
      "transformed_scenario_id": "citation-omitted",
      "relation": "atomic_omission",
      "changed_requirements": [
        "grounded_citation"
      ],
      "probability_deltas": {},
      "reward_delta": 0.0,
      "checks": {
        "same_requirement_set": true,
        "atomic_probability_map": false,
        "one_true_to_false": true,
        "affected_probability_decreases": false,
        "unaffected_probabilities_stable": false,
        "reward_decreases": false
      },
      "passed": false
    },
    {
      "reference_scenario_id": "reference",
      "transformed_scenario_id": "irrelevant-context",
      "relation": "irrelevant_context",
      "changed_requirements": [],
      "probability_deltas": {},
      "reward_delta": 0.0,
      "checks": {
        "same_requirement_set": true,
        "atomic_probability_map": false,
        "truth_unchanged": true,
        "probabilities_stable": false,
        "reward_stable": true
      },
      "passed": false
    },
    {
      "reference_scenario_id": "reference",
      "transformed_scenario_id": "requirements-reordered",
      "relation": "reorder",
      "changed_requirements": [],
      "probability_deltas": {},
      "reward_delta": 0.0,
      "checks": {
        "same_requirement_set": true,
        "atomic_probability_map": false,
        "truth_unchanged": true,
        "order_changed": true,
        "probabilities_stable": false,
        "reward_stable": true
      },
      "passed": false
    }
  ],
  "claim_boundary": "This audit detects declared checklist and judgment failures in supplied outputs. It does not prove semantic completeness, model safety, or causal faithfulness of hidden reasoning."
}
